{
  "chainId": 688688,
  "from": "0xaaaaaaaaaaaaaaaaaaaaaaaaaaaaaaaaaaaaaaaa",
  "to": "0x1111111111111111111111111111111111111111",
  "valueWei": "10000000000000000",
  "data": "0x",
  "intent": "Pay an approved service provider inside the mission budget.",
  "metadata": {
    "agent": "demo-agent",
    "missionId": "mission-001"
  }
}
